{"schemaVersion":1,"defaultLocale":"zh-CN","locales":["zh-CN","en-US"],"resources":{"characters":{"f0303244-602a-4ebc-bc70-97b463740999":{"key":"narrator","nameKey":"character.f0303244-602a-4ebc-bc70-97b463740999.name"}},"variables":{"08f312e2-9fc2-564d-9a76-f425682aaf83":{"key":"accepted","type":"boolean","defaultValue":false},"4fda17ea-8967-5347-9f92-1532de5fb3f5":{"key":"title","type":"string","defaultValue":"hero"},"8e461bd2-aa25-5893-a1ac-e2dba3caba70":{"key":"score","type":"number","defaultValue":0}},"events":{"035c644a-d873-5667-b0da-0e9897305c7e":{"key":"quest.begin","params":[{"key":"quest","type":"string","required":true,"defaultValue":null,"description":""}]}}},"localePaths":{"en-US":"locales/en-US/global.json","zh-CN":"locales/zh-CN/global.json"},"dialogues":{"2fd88ddc-aa3b-466f-92a2-48785adce71e":{"key":"sdk_demo","structurePath":"dialogues/Chapter1/runtime.json","localePaths":{"en-US":"locales/en-US/dialogues/Chapter1/runtime.json","zh-CN":"locales/zh-CN/dialogues/Chapter1/runtime.json"}},"32d95459-a856-5c3c-8583-58f794fb3a4f":{"key":"root_demo","structurePath":"dialogues.runtime.json","localePaths":{"en-US":"locales/en-US/dialogues.runtime.json","zh-CN":"locales/zh-CN/dialogues.runtime.json"}}}}
